{
  "env": null,
  "generatedAt": "2026-09-06T00:00:00Z",
  "inputs": [],
  "outputs": {
    "manifest": "fields.fluxplot.json",
    "svg": "fields.svg"
  },
  "params": {
    "__fluxplot__": {
      "correlation": {
        "cmap": "viridis",
        "extend": "neither",
        "norm": {
          "kind": "linear"
        },
        "vmax": 1.0,
        "vmin": 0.0
      },
      "energy": {
        "cmap": "plasma",
        "extend": "neither",
        "norm": {
          "kind": "linear"
        },
        "vmax": 8.0,
        "vmin": 0.0
      }
    }
  },
  "plot": "fields",
  "schemaVersion": "0.3.1",
  "script": null,
  "spec": "fluxplot/recipe"
}
