{
  "env": null,
  "generatedAt": "2000-01-01T00:00:00Z",
  "inputs": [],
  "outputs": {
    "glb": "categorical-missing.glb",
    "manifest": "categorical-missing.fluxplot.json"
  },
  "params": {},
  "plot": "categorical-missing",
  "schemaVersion": "0.4.0",
  "script": null,
  "spec": "fluxplot/recipe"
}
