{
  "env": null,
  "generatedAt": "2000-01-01T00:00:00Z",
  "inputs": [],
  "outputs": {
    "glb": "morph-incompatible.glb",
    "manifest": "morph-incompatible.fluxplot.json"
  },
  "params": {},
  "plot": "morph-incompatible",
  "schemaVersion": "0.4.0",
  "script": null,
  "spec": "fluxplot/recipe"
}
